{
  "$schema": "https://json-schema.org/draft/2020-12/schema",
  "$id": "https://render-scope.web.app/schemas/scene.schema.json",
  "title": "RenderScope Scene",
  "description": "Metadata for a standard benchmark scene.",
  "type": "object",
  "required": [
    "id",
    "name",
    "description",
    "tests",
    "complexity",
    "source",
    "available_formats",
    "sources"
  ],
  "additionalProperties": false,
  "properties": {
    "id": {
      "type": "string",
      "description": "URL-safe slug used as filename and cross-reference key.",
      "pattern": "^[a-z0-9]+(?:-[a-z0-9]+)*$"
    },
    "name": {
      "type": "string",
      "description": "Human-readable display name for the scene."
    },
    "description": {
      "type": "string",
      "description": "What this scene is and what rendering features it tests, 1-3 sentences."
    },
    "tests": {
      "type": "array",
      "description": "Rendering features this scene is designed to test.",
      "items": {
        "type": "string",
        "enum": [
          "global_illumination",
          "color_bleeding",
          "soft_shadows",
          "indirect_light",
          "caustics",
          "volumetric",
          "subsurface_scattering",
          "complex_geometry",
          "textures",
          "hdri_lighting",
          "motion_blur",
          "depth_of_field",
          "transparency",
          "reflections",
          "outdoor_lighting"
        ]
      },
      "minItems": 1,
      "uniqueItems": true
    },
    "complexity": {
      "type": "string",
      "description": "Overall scene complexity rating.",
      "enum": [
        "trivial",
        "low",
        "medium",
        "high",
        "extreme"
      ]
    },
    "vertices": {
      "type": "integer",
      "description": "Total vertex count in the scene.",
      "minimum": 0
    },
    "faces": {
      "type": "integer",
      "description": "Total face/triangle count in the scene.",
      "minimum": 0
    },
    "lights": {
      "type": "integer",
      "description": "Number of light sources in the scene.",
      "minimum": 0
    },
    "light_types": {
      "type": "array",
      "description": "Types of lights present in the scene.",
      "items": {
        "type": "string",
        "enum": [
          "point",
          "area",
          "directional",
          "spot",
          "hdri",
          "ies",
          "emissive_geometry"
        ]
      },
      "uniqueItems": true
    },
    "textures": {
      "type": "integer",
      "description": "Number of texture maps used.",
      "minimum": 0
    },
    "source": {
      "type": "string",
      "description": "Attribution — who created or provided the scene."
    },
    "source_url": {
      "type": "string",
      "description": "Link to the original scene source.",
      "format": "uri"
    },
    "license": {
      "type": "string",
      "description": "Scene license (SPDX identifier or description)."
    },
    "available_formats": {
      "type": "array",
      "description": "Scene file formats available for download.",
      "items": {
        "type": "string"
      },
      "minItems": 1,
      "uniqueItems": true
    },
    "sources": {
      "type": "object",
      "description": "Per-format acquisition detail, keyed by format id. Its keys are the single source of truth for which formats exist; 'available_formats' must list exactly the same set.",
      "minProperties": 1,
      "propertyNames": {
        "pattern": "^[a-z0-9]+(?:_[a-z0-9]+)*$"
      },
      "additionalProperties": {
        "type": "object",
        "description": "How one format of this scene is obtained and where its entry file sits once installed.",
        "required": [
          "path"
        ],
        "additionalProperties": false,
        "properties": {
          "path": {
            "type": "string",
            "description": "Path to the scene's entry file relative to this format's directory, exactly as the source archive lays it out. Installed at <scenes_dir>/<scene_id>/<format>/<path>.",
            "minLength": 1
          },
          "url": {
            "type": "string",
            "description": "Fully-qualified URL of the archive or loose file to download. Omit when no automated source exists; the format is then declared but must be acquired manually.",
            "format": "uri"
          },
          "archive": {
            "type": "string",
            "description": "Archive filename relative to a configured scene mirror (RENDERSCOPE_SCENE_BASE_URL). Used only when a mirror is set."
          },
          "sha256": {
            "type": "string",
            "description": "Expected SHA-256 of the downloaded bytes, lowercase hex.",
            "pattern": "^[0-9a-f]{64}$"
          },
          "size_mb": {
            "type": "number",
            "description": "Download size in megabytes, measured from the source.",
            "minimum": 0
          },
          "filename": {
            "type": "string",
            "description": "Name to save the download as when the source is a single loose file rather than an archive."
          },
          "note": {
            "type": "string",
            "description": "Anything a user needs to know about this source."
          }
        }
      }
    },
    "reference": {
      "type": "object",
      "description": "The ground-truth render every quality metric for this scene is measured against. Produced by 'renderscope reference'.",
      "required": [
        "renderer",
        "samples",
        "image"
      ],
      "additionalProperties": false,
      "properties": {
        "renderer": {
          "type": "string",
          "description": "Renderer id nominated to produce the ground truth."
        },
        "samples": {
          "type": "integer",
          "description": "Samples per pixel the reference is rendered at.",
          "minimum": 1
        },
        "image": {
          "type": "string",
          "description": "Reference image path relative to the scene's directory.",
          "minLength": 1
        },
        "url": {
          "type": "string",
          "description": "Where a pre-rendered reference can be downloaded, once hosted.",
          "format": "uri"
        },
        "sha256": {
          "type": "string",
          "description": "Expected SHA-256 of the reference image, lowercase hex.",
          "pattern": "^[0-9a-f]{64}$"
        }
      }
    },
    "thumbnail": {
      "type": "string",
      "description": "Relative path to the scene thumbnail image."
    },
    "resolution": {
      "type": "array",
      "description": "Default render resolution as [width, height].",
      "items": {
        "type": "integer",
        "minimum": 1
      },
      "minItems": 2,
      "maxItems": 2
    },
    "renders": {
      "type": "array",
      "description": "Pre-rendered images for this scene from various renderers.",
      "items": {
        "type": "object",
        "required": [
          "renderer_id"
        ],
        "additionalProperties": true,
        "properties": {
          "renderer_id": {
            "type": "string",
            "description": "Renderer id that produced this render."
          },
          "image_web": {
            "type": "string",
            "description": "Path to web-resolution rendered image."
          },
          "image_thumb": {
            "type": "string",
            "description": "Path to thumbnail rendered image."
          },
          "render_time_seconds": {
            "type": [
              "number",
              "null"
            ],
            "description": "Render time in seconds."
          },
          "samples_per_pixel": {
            "type": [
              "integer",
              "null"
            ],
            "description": "Samples per pixel used."
          },
          "integrator": {
            "type": [
              "string",
              "null"
            ],
            "description": "Integrator or algorithm used."
          }
        }
      }
    },
    "camera": {
      "type": "object",
      "description": "Standard camera position for consistent benchmarking.",
      "additionalProperties": false,
      "properties": {
        "position": {
          "type": "array",
          "description": "Camera position as [x, y, z].",
          "items": {
            "type": "number"
          },
          "minItems": 3,
          "maxItems": 3
        },
        "look_at": {
          "type": "array",
          "description": "Camera look-at target as [x, y, z].",
          "items": {
            "type": "number"
          },
          "minItems": 3,
          "maxItems": 3
        },
        "up": {
          "type": "array",
          "description": "Camera up vector as [x, y, z].",
          "items": {
            "type": "number"
          },
          "minItems": 3,
          "maxItems": 3
        },
        "fov": {
          "type": "number",
          "description": "Vertical field of view in degrees.",
          "minimum": 0,
          "maximum": 180
        }
      }
    }
  }
}
