{
  "id": "veach-mis",
  "name": "Veach MIS",
  "description": "Eric Veach's classic test scene designed to demonstrate the importance of Multiple Importance Sampling. Features four plates with varying roughness illuminated by four lights of varying size. Exposes algorithmic differences in how renderers sample difficult light transport paths — a diagnostic tool more than a beauty test.",
  "tests": [
    "global_illumination",
    "reflections",
    "soft_shadows"
  ],
  "complexity": "low",
  "vertices": 1200,
  "faces": 1200,
  "lights": 4,
  "light_types": [
    "area"
  ],
  "textures": 0,
  "source": "Eric Veach / PBRT Scene Repository",
  "source_url": "https://pbrt.org/scenes-v4",
  "license": "Public domain",
  "available_formats": [
    "mitsuba_xml",
    "pbrt"
  ],
  "sources": {
    "mitsuba_xml": {
      "url": "https://benedikt-bitterli.me/resources/mitsuba/veach-mis.zip",
      "sha256": "b90851ba861c802ace8a61cde43116576edc754a12b1ddd7308b68d65371770c",
      "size_mb": 1.91,
      "path": "veach-mis/scene_v3.xml",
      "note": "Benedikt Bitterli's resource pack; also ships a Tungsten reference render (TungstenRender.exr) alongside the scene description."
    },
    "pbrt": {
      "url": "https://benedikt-bitterli.me/resources/pbrt-v4/veach-mis.zip",
      "sha256": "a23345a4ebd47078beaf689c74bc84cc81954cdf4a8008cdb918ace04f187b0c",
      "size_mb": 1.91,
      "path": "veach-mis/scene-v4.pbrt",
      "note": "Benedikt Bitterli's resource pack; also ships a Tungsten reference render (TungstenRender.exr) alongside the scene description."
    }
  },
  "reference": {
    "renderer": "pbrt",
    "samples": 65536,
    "image": "reference.exr"
  },
  "thumbnail": "/renders/veach-mis/thumbnail.webp",
  "renders": [
    {
      "renderer_id": "mitsuba3",
      "image_web": "/renders/veach-mis/mitsuba3_1920x1080.webp",
      "image_thumb": "/renders/veach-mis/mitsuba3_400x225.webp",
      "render_time_seconds": null,
      "samples_per_pixel": 1024,
      "integrator": null
    },
    {
      "renderer_id": "pbrt",
      "image_web": "/renders/veach-mis/pbrt_1920x1080.webp",
      "image_thumb": "/renders/veach-mis/pbrt_400x225.webp",
      "render_time_seconds": 121.9,
      "samples_per_pixel": 1024,
      "integrator": "path"
    }
  ],
  "camera": {
    "position": [
      0,
      2,
      15
    ],
    "look_at": [
      0,
      1.69,
      0
    ],
    "up": [
      0,
      1,
      0
    ],
    "fov": 20
  }
}
