{
  "id": "sponza",
  "name": "Sponza Atrium",
  "description": "An architectural interior based on the Sponza Palace atrium in Dubrovnik, Croatia. A standard benchmark for testing complex indirect lighting, light interaction across many surfaces, and texture-heavy scenes. Used in virtually every rendering research paper as a reference scene.",
  "tests": [
    "global_illumination",
    "indirect_light",
    "textures",
    "complex_geometry"
  ],
  "complexity": "medium",
  "vertices": 153635,
  "faces": 262267,
  "lights": 1,
  "light_types": [
    "directional",
    "emissive_geometry"
  ],
  "textures": 25,
  "source": "Crytek / Morgan McGuire Computer Graphics Archive",
  "source_url": "https://casual-effects.com/data/",
  "license": "CC-BY-3.0",
  "available_formats": [
    "obj"
  ],
  "sources": {
    "obj": {
      "url": "https://casual-effects.com/g3d/data10/common/model/crytek_sponza/sponza.zip",
      "sha256": "da005cbee0be2df2abc8513f3ceb61bcb6f69aac112babcd9c00169a27c2770c",
      "size_mb": 76.4,
      "path": "sponza.obj"
    }
  },
  "reference": {
    "renderer": "blender-cycles",
    "samples": 65536,
    "image": "reference.exr"
  },
  "thumbnail": "/renders/sponza/thumbnail.webp",
  "resolution": [
    1920,
    1080
  ],
  "renders": [
    {
      "renderer_id": "blender-cycles",
      "image_web": "/renders/sponza/blender-cycles_1920x1080.webp",
      "image_thumb": "/renders/sponza/blender-cycles_400x225.webp",
      "render_time_seconds": null,
      "samples_per_pixel": 1024,
      "integrator": null
    }
  ],
  "camera": {
    "position": [
      -10,
      2,
      0
    ],
    "look_at": [
      0,
      2,
      0
    ],
    "up": [
      0,
      1,
      0
    ],
    "fov": 60
  }
}
