{
  "id": "cornell-box",
  "name": "Cornell Box",
  "description": "The classic global illumination test scene, originally measured at Cornell University. Tests fundamental light transport: color bleeding between diffuse walls, soft shadows from an area light source, and indirect illumination. The simplest meaningful GI benchmark — every physically based renderer should produce a recognizable result.",
  "tests": [
    "global_illumination",
    "color_bleeding",
    "soft_shadows",
    "indirect_light"
  ],
  "complexity": "trivial",
  "vertices": 24,
  "faces": 32,
  "lights": 1,
  "light_types": [
    "area"
  ],
  "textures": 0,
  "source": "Cornell University Program of Computer Graphics",
  "source_url": "https://www.graphics.cornell.edu/online/box/data.html",
  "license": "Public domain",
  "available_formats": [
    "mitsuba_xml",
    "obj",
    "pbrt"
  ],
  "sources": {
    "mitsuba_xml": {
      "url": "https://benedikt-bitterli.me/resources/mitsuba/cornell-box.zip",
      "sha256": "d57ffb9d176d34cc45d3d570b51e75be1dc6a4edc78879ba6fe40e2ce093e645",
      "size_mb": 3.22,
      "path": "cornell-box/scene_v3.xml",
      "note": "Benedikt Bitterli's resource pack; also ships a Tungsten reference render (TungstenRender.exr) alongside the scene description."
    },
    "obj": {
      "url": "https://casual-effects.com/g3d/data10/common/model/CornellBox/CornellBox.zip",
      "sha256": "f27eaf47afec74b5236ce3095ac02d4256e8ac8610bfdb5a53560c67c2e0d8f1",
      "size_mb": 0.21,
      "path": "CornellBox-Original.obj"
    },
    "pbrt": {
      "url": "https://benedikt-bitterli.me/resources/pbrt-v4/cornell-box.zip",
      "sha256": "3ac9dcd287f7079b23dbc9eaefe19e64c942c0ec3740b328e09d44c2163b835d",
      "size_mb": 3.22,
      "path": "cornell-box/scene-v4.pbrt",
      "note": "Benedikt Bitterli's resource pack; also ships a Tungsten reference render (TungstenRender.exr) alongside the scene description."
    }
  },
  "reference": {
    "renderer": "pbrt",
    "samples": 65536,
    "image": "reference.exr"
  },
  "thumbnail": "/renders/cornell-box/thumbnail.webp",
  "resolution": [
    1920,
    1080
  ],
  "renders": [
    {
      "renderer_id": "mitsuba3",
      "image_web": "/renders/cornell-box/mitsuba3_1920x1080.webp",
      "image_thumb": "/renders/cornell-box/mitsuba3_400x225.webp",
      "render_time_seconds": null,
      "samples_per_pixel": 1024,
      "integrator": null
    },
    {
      "renderer_id": "pbrt",
      "image_web": "/renders/cornell-box/pbrt_1920x1080.webp",
      "image_thumb": "/renders/cornell-box/pbrt_400x225.webp",
      "render_time_seconds": 47.3,
      "samples_per_pixel": 1024,
      "integrator": "volpath"
    }
  ],
  "camera": {
    "position": [
      278,
      273,
      -800
    ],
    "look_at": [
      278,
      273,
      0
    ],
    "up": [
      0,
      1,
      0
    ],
    "fov": 39.3
  }
}
